"No.","Time","Source","Destination","Protocol","Length","Info"
"1","0.000000","25.59.115.113","224.0.0.251","MDNS","421","Standard query response 0x0000 PTR, cache flush DESKTOP-328MM0M.local PTR, cache flush DESKTOP-328MM0M.local PTR, cache flush DESKTOP-328MM0M.local A, cache flush 25.59.115.113 AAAA, cache flush 2620:9b::193b:7371 AAAA, cache flush fe80::141e:c36:d76e:62e8 NSEC, cache flush 113.115.59.25.in-addr.arpa NSEC, cache flush 1.7.3.7.B.3.9.1.0.0.0.0.0.0.0.0.0.0.0.0.0.0.0.0.B.9.0.0.0.2.6.2.ip6.arpa NSEC, cache flush 8.E.2.6.E.6.7.D.6.3.C.0.E.1.4.1.0.0.0.0.0.0.0.0.0.0.0.0.0.8.E.F.ip6.arpa NSEC, cache flush DESKTOP-328MM0M.local"
"2","0.033491","25.94.9.254","25.114.157.253","TCP","60","53788  >  1234 [PSH, ACK] Seq=1 Ack=1 Win=65472 Len=5"
"3","0.074032","25.114.157.253","25.94.9.254","TCP","54","1234  >  53788 [ACK] Seq=1 Ack=6 Win=64767 Len=0"
"4","0.075661","25.59.115.113","25.114.157.253","TCP","60","58363  >  1234 [PSH, ACK] Seq=1 Ack=1 Win=64912 Len=1"
"5","0.077795","25.114.157.253","25.59.115.113","TCP","58","1234  >  58363 [PSH, ACK] Seq=1 Ack=2 Win=65245 Len=4"
"6","0.267641","25.59.115.113","25.114.157.253","TCP","60","58363  >  1234 [ACK] Seq=2 Ack=5 Win=64908 Len=0"
"7","0.536034","25.59.115.113","25.114.157.253","TCP","60","58363  >  1234 [PSH, ACK] Seq=2 Ack=5 Win=64908 Len=1"
"8","0.559347","25.94.9.254","25.114.157.253","TCP","60","53788  >  1234 [PSH, ACK] Seq=6 Ack=1 Win=65472 Len=5"
"9","0.576590","25.114.157.253","25.59.115.113","TCP","54","1234  >  58363 [ACK] Seq=5 Ack=3 Win=65244 Len=0"
"10","0.600114","25.114.157.253","25.94.9.254","TCP","54","1234  >  53788 [ACK] Seq=1 Ack=11 Win=64762 Len=0"
"11","0.803765","25.59.115.113","25.114.157.253","TCP","60","58363  >  1234 [PSH, ACK] Seq=3 Ack=5 Win=64908 Len=1"
"12","0.806292","25.114.157.253","25.59.115.113","TCP","58","1234  >  58363 [PSH, ACK] Seq=5 Ack=4 Win=65243 Len=4"
"13","0.901805","25.59.115.113","25.114.157.253","TCP","60","58363  >  1234 [ACK] Seq=4 Ack=9 Win=64904 Len=0"
"14","1.087536","25.59.115.113","25.114.157.253","TCP","60","58363  >  1234 [PSH, ACK] Seq=4 Ack=9 Win=64904 Len=1"
"15","1.090643","25.94.9.254","25.114.157.253","TCP","60","53788  >  1234 [PSH, ACK] Seq=11 Ack=1 Win=65472 Len=5"
"16","1.127921","25.114.157.253","25.59.115.113","TCP","54","1234  >  58363 [ACK] Seq=9 Ack=5 Win=65242 Len=0"
"17","1.131780","25.114.157.253","25.94.9.254","TCP","54","1234  >  53788 [ACK] Seq=1 Ack=16 Win=64757 Len=0"
"18","1.445850","25.59.115.113","25.114.157.253","TCP","60","58363  >  1234 [PSH, ACK] Seq=5 Ack=9 Win=64904 Len=1"
"19","1.448142","25.114.157.253","25.59.115.113","TCP","58","1234  >  58363 [PSH, ACK] Seq=9 Ack=6 Win=65241 Len=4"
"20","1.525786","25.59.115.113","25.114.157.253","TCP","60","58363  >  1234 [ACK] Seq=6 Ack=13 Win=64900 Len=0"
"21","1.610033","25.94.9.254","25.114.157.253","TCP","60","53788  >  1234 [PSH, ACK] Seq=16 Ack=1 Win=65472 Len=5"
"22","1.653097","25.114.157.253","25.94.9.254","TCP","54","1234  >  53788 [ACK] Seq=1 Ack=21 Win=64752 Len=0"
"23","1.743578","25.59.115.113","25.114.157.253","TCP","60","58363  >  1234 [PSH, ACK] Seq=6 Ack=13 Win=64900 Len=1"
"24","1.745804","25.114.157.253","25.59.115.113","TCP","58","1234  >  58363 [PSH, ACK] Seq=13 Ack=7 Win=65240 Len=4"
"25","1.823573","25.59.115.113","25.114.157.253","TCP","60","58363  >  1234 [ACK] Seq=7 Ack=17 Win=64896 Len=0"
"26","2.038367","25.59.115.113","25.114.157.253","TCP","60","58363  >  1234 [PSH, ACK] Seq=7 Ack=17 Win=64896 Len=1"
"27","2.080094","25.114.157.253","25.59.115.113","TCP","54","1234  >  58363 [ACK] Seq=17 Ack=8 Win=65239 Len=0"
"28","2.132538","25.94.9.254","25.114.157.253","TCP","60","53788  >  1234 [PSH, ACK] Seq=21 Ack=1 Win=65472 Len=5"
"29","2.173822","25.114.157.253","25.94.9.254","TCP","54","1234  >  53788 [ACK] Seq=1 Ack=26 Win=64747 Len=0"
"30","2.410599","25.59.115.113","25.114.157.253","TCP","60","58363  >  1234 [PSH, ACK] Seq=8 Ack=17 Win=64896 Len=1"
"31","2.412836","25.114.157.253","25.59.115.113","TCP","58","1234  >  58363 [PSH, ACK] Seq=17 Ack=9 Win=65238 Len=4"
"32","2.503768","25.59.115.113","25.114.157.253","TCP","60","58363  >  1234 [ACK] Seq=9 Ack=21 Win=64892 Len=0"
"33","2.663316","25.94.9.254","25.114.157.253","TCP","60","53788  >  1234 [PSH, ACK] Seq=26 Ack=1 Win=65472 Len=5"
"34","2.703615","25.114.157.253","25.94.9.254","TCP","54","1234  >  53788 [ACK] Seq=1 Ack=31 Win=64742 Len=0"
"35","2.723370","25.59.115.113","25.114.157.253","TCP","60","58363  >  1234 [PSH, ACK] Seq=9 Ack=21 Win=64892 Len=1"
"36","2.726073","25.114.157.253","25.59.115.113","TCP","58","1234  >  58363 [PSH, ACK] Seq=21 Ack=10 Win=65237 Len=4"
"37","2.809891","25.59.115.113","25.114.157.253","TCP","60","58363  >  1234 [ACK] Seq=10 Ack=25 Win=64888 Len=0"
"38","3.014869","25.59.115.113","25.114.157.253","TCP","60","58363  >  1234 [PSH, ACK] Seq=10 Ack=25 Win=64888 Len=1"
"39","3.055265","25.114.157.253","25.59.115.113","TCP","54","1234  >  58363 [ACK] Seq=25 Ack=11 Win=65236 Len=0"
"40","3.189210","25.94.9.254","25.114.157.253","TCP","60","53788  >  1234 [PSH, ACK] Seq=31 Ack=1 Win=65472 Len=5"
"41","3.229849","25.114.157.253","25.94.9.254","TCP","54","1234  >  53788 [ACK] Seq=1 Ack=36 Win=64737 Len=0"
"42","3.376429","25.59.115.113","25.114.157.253","TCP","60","58363  >  1234 [PSH, ACK] Seq=11 Ack=25 Win=64888 Len=1"
"43","3.378593","25.114.157.253","25.59.115.113","TCP","58","1234  >  58363 [PSH, ACK] Seq=25 Ack=12 Win=65235 Len=4"
"44","3.469791","25.59.115.113","25.114.157.253","TCP","60","58363  >  1234 [ACK] Seq=12 Ack=29 Win=64884 Len=0"
"45","3.688639","25.59.115.113","25.114.157.253","TCP","60","58363  >  1234 [PSH, ACK] Seq=12 Ack=29 Win=64884 Len=1"
"46","3.705226","25.94.9.254","25.114.157.253","TCP","60","53788  >  1234 [PSH, ACK] Seq=36 Ack=1 Win=65472 Len=5"
"47","3.729731","25.114.157.253","25.59.115.113","TCP","54","1234  >  58363 [ACK] Seq=29 Ack=13 Win=65234 Len=0"
"48","3.747093","25.114.157.253","25.94.9.254","TCP","54","1234  >  53788 [ACK] Seq=1 Ack=41 Win=64732 Len=0"
"49","4.046800","25.59.115.113","25.114.157.253","TCP","60","58363  >  1234 [PSH, ACK] Seq=13 Ack=29 Win=64884 Len=1"
"50","4.049180","25.114.157.253","25.59.115.113","TCP","58","1234  >  58363 [PSH, ACK] Seq=29 Ack=14 Win=65233 Len=4"
"51","4.140766","25.59.115.113","25.114.157.253","TCP","60","58363  >  1234 [ACK] Seq=14 Ack=33 Win=64880 Len=0"
"52","4.225989","25.94.9.254","25.114.157.253","TCP","60","53788  >  1234 [PSH, ACK] Seq=41 Ack=1 Win=65472 Len=5"
"53","4.266099","25.114.157.253","25.94.9.254","TCP","54","1234  >  53788 [ACK] Seq=1 Ack=46 Win=64727 Len=0"
"54","4.325210","25.59.115.113","25.114.157.253","TCP","60","58363  >  1234 [PSH, ACK] Seq=14 Ack=33 Win=64880 Len=1"
"55","4.327208","25.114.157.253","25.59.115.113","TCP","58","1234  >  58363 [PSH, ACK] Seq=33 Ack=15 Win=65232 Len=4"
"56","4.420176","25.59.115.113","25.114.157.253","TCP","60","58363  >  1234 [ACK] Seq=15 Ack=37 Win=64876 Len=0"
"57","4.676460","25.59.115.113","25.114.157.253","TCP","60","58363  >  1234 [PSH, ACK] Seq=15 Ack=37 Win=64876 Len=1"
"58","4.717514","25.114.157.253","25.59.115.113","TCP","54","1234  >  58363 [ACK] Seq=37 Ack=16 Win=65231 Len=0"
"59","4.742987","25.94.9.254","25.114.157.253","TCP","60","53788  >  1234 [PSH, ACK] Seq=46 Ack=1 Win=65472 Len=5"
"60","4.782430","25.114.157.253","25.94.9.254","TCP","54","1234  >  53788 [ACK] Seq=1 Ack=51 Win=64722 Len=0"
"61","5.020793","25.59.115.113","25.114.157.253","TCP","60","58363  >  1234 [PSH, ACK] Seq=16 Ack=37 Win=64876 Len=1"
"62","5.024090","25.114.157.253","25.59.115.113","TCP","58","1234  >  58363 [PSH, ACK] Seq=37 Ack=17 Win=65230 Len=4"
"63","5.133541","25.59.115.113","25.114.157.253","TCP","60","58363  >  1234 [ACK] Seq=17 Ack=41 Win=64872 Len=0"
"64","5.265914","25.94.9.254","25.114.157.253","TCP","60","53788  >  1234 [PSH, ACK] Seq=51 Ack=1 Win=65472 Len=5"
"65","5.306436","25.114.157.253","25.94.9.254","TCP","54","1234  >  53788 [ACK] Seq=1 Ack=56 Win=64717 Len=0"
"66","5.404080","25.59.115.113","25.114.157.253","TCP","60","58363  >  1234 [PSH, ACK] Seq=17 Ack=41 Win=64872 Len=1"
"67","5.408334","25.114.157.253","25.59.115.113","TCP","58","1234  >  58363 [PSH, ACK] Seq=41 Ack=18 Win=65229 Len=4"
"68","5.498450","25.59.115.113","25.114.157.253","TCP","60","58363  >  1234 [ACK] Seq=18 Ack=45 Win=64868 Len=0"
"69","5.715564","25.59.115.113","25.114.157.253","TCP","60","58363  >  1234 [PSH, ACK] Seq=18 Ack=45 Win=64868 Len=1"
"70","5.756225","25.114.157.253","25.59.115.113","TCP","54","1234  >  58363 [ACK] Seq=45 Ack=19 Win=65228 Len=0"
"71","5.783963","25.94.9.254","25.114.157.253","TCP","60","53788  >  1234 [PSH, ACK] Seq=56 Ack=1 Win=65472 Len=5"
"72","5.825183","25.114.157.253","25.94.9.254","TCP","54","1234  >  53788 [ACK] Seq=1 Ack=61 Win=64712 Len=0"
"73","6.096926","25.59.115.113","25.114.157.253","TCP","60","58363  >  1234 [PSH, ACK] Seq=19 Ack=45 Win=64868 Len=1"
"74","6.099156","25.114.157.253","25.59.115.113","TCP","58","1234  >  58363 [PSH, ACK] Seq=45 Ack=20 Win=65227 Len=4"
"75","6.248101","25.59.115.113","25.114.157.253","TCP","60","58363  >  1234 [ACK] Seq=20 Ack=49 Win=64864 Len=0"
"76","6.316004","25.94.9.254","25.114.157.253","TCP","60","53788  >  1234 [PSH, ACK] Seq=61 Ack=1 Win=65472 Len=5"
"77","6.355762","25.114.157.253","25.94.9.254","TCP","54","1234  >  53788 [ACK] Seq=1 Ack=66 Win=64707 Len=0"
"78","6.526063","25.59.115.113","25.114.157.253","TCP","60","58363  >  1234 [PSH, ACK] Seq=20 Ack=49 Win=64864 Len=1"
"79","6.526151","25.94.9.254","25.255.255.255","NBNS","92","Name query NB WORKGROUP<1c>"
"80","6.527890","25.114.157.253","25.59.115.113","TCP","58","1234  >  58363 [PSH, ACK] Seq=49 Ack=21 Win=65226 Len=4"
"81","6.620454","25.59.115.113","25.114.157.253","TCP","60","58363  >  1234 [ACK] Seq=21 Ack=53 Win=64860 Len=0"
"82","6.813949","25.59.115.113","25.114.157.253","TCP","60","58363  >  1234 [PSH, ACK] Seq=21 Ack=53 Win=64860 Len=1"
"83","6.841069","25.94.9.254","25.114.157.253","TCP","60","53788  >  1234 [PSH, ACK] Seq=66 Ack=1 Win=65472 Len=5"
"84","6.854168","25.114.157.253","25.59.115.113","TCP","54","1234  >  58363 [ACK] Seq=53 Ack=22 Win=65225 Len=0"
"85","6.882941","25.114.157.253","25.94.9.254","TCP","54","1234  >  53788 [ACK] Seq=1 Ack=71 Win=64702 Len=0"
"86","7.079853","25.59.115.113","25.114.157.253","TCP","60","58363  >  1234 [PSH, ACK] Seq=22 Ack=53 Win=64860 Len=1"
"87","7.082217","25.114.157.253","25.59.115.113","TCP","58","1234  >  58363 [PSH, ACK] Seq=53 Ack=23 Win=65224 Len=4"
"88","7.271780","25.59.115.113","25.114.157.253","TCP","60","58363  >  1234 [ACK] Seq=23 Ack=57 Win=64856 Len=0"
"89","7.271864","25.94.9.254","25.255.255.255","NBNS","92","Name query NB WORKGROUP<1c>"
"90","7.356705","25.94.9.254","25.114.157.253","TCP","60","53788  >  1234 [PSH, ACK] Seq=71 Ack=1 Win=65472 Len=5"
"91","7.362070","25.59.115.113","25.114.157.253","TCP","60","58363  >  1234 [PSH, ACK] Seq=23 Ack=57 Win=64856 Len=1"
"92","7.363756","25.114.157.253","25.59.115.113","TCP","58","1234  >  58363 [PSH, ACK] Seq=57 Ack=24 Win=65223 Len=4"
"93","7.396821","25.114.157.253","25.94.9.254","TCP","54","1234  >  53788 [ACK] Seq=1 Ack=76 Win=64697 Len=0"
"94","7.538318","25.59.115.113","25.114.157.253","TCP","60","58363  >  1234 [ACK] Seq=24 Ack=61 Win=64852 Len=0"
"95","7.671458","25.59.115.113","25.114.157.253","TCP","60","58363  >  1234 [PSH, ACK] Seq=24 Ack=61 Win=64852 Len=1"
"96","7.713237","25.114.157.253","25.59.115.113","TCP","54","1234  >  58363 [ACK] Seq=61 Ack=25 Win=65222 Len=0"
"97","7.873069","25.94.9.254","25.114.157.253","TCP","60","53788  >  1234 [PSH, ACK] Seq=76 Ack=1 Win=65472 Len=5"
"98","7.913534","25.114.157.253","25.94.9.254","TCP","54","1234  >  53788 [ACK] Seq=1 Ack=81 Win=64692 Len=0"
"99","8.072101","25.94.9.254","25.255.255.255","NBNS","92","Name query NB WORKGROUP<1c>"
"100","8.072540","25.59.115.113","25.114.157.253","TCP","60","58363  >  1234 [PSH, ACK] Seq=25 Ack=61 Win=64852 Len=1"
"101","8.074757","25.114.157.253","25.59.115.113","TCP","58","1234  >  58363 [PSH, ACK] Seq=61 Ack=26 Win=65221 Len=4"
"102","8.339074","25.59.115.113","25.114.157.253","TCP","60","58363  >  1234 [ACK] Seq=26 Ack=65 Win=64848 Len=0"
"103","8.403146","25.94.9.254","25.114.157.253","TCP","60","53788  >  1234 [PSH, ACK] Seq=81 Ack=1 Win=65472 Len=5"
"104","8.442958","25.114.157.253","25.94.9.254","TCP","54","1234  >  53788 [ACK] Seq=1 Ack=86 Win=64687 Len=0"
"105","8.461399","25.59.115.113","25.114.157.253","TCP","60","58363  >  1234 [PSH, ACK] Seq=26 Ack=65 Win=64848 Len=1"
"106","8.463673","25.114.157.253","25.59.115.113","TCP","58","1234  >  58363 [PSH, ACK] Seq=65 Ack=27 Win=65220 Len=4"
"107","8.606254","25.59.115.113","25.114.157.253","TCP","60","58363  >  1234 [ACK] Seq=27 Ack=69 Win=64844 Len=0"
"108","8.741429","25.59.115.113","25.114.157.253","TCP","60","58363  >  1234 [PSH, ACK] Seq=27 Ack=69 Win=64844 Len=1"
"109","8.782187","25.114.157.253","25.59.115.113","TCP","54","1234  >  58363 [ACK] Seq=69 Ack=28 Win=65219 Len=0"
"110","8.931442","25.94.9.254","25.114.157.253","TCP","60","53788  >  1234 [PSH, ACK] Seq=86 Ack=1 Win=65472 Len=5"
"111","8.972787","25.114.157.253","25.94.9.254","TCP","54","1234  >  53788 [ACK] Seq=1 Ack=91 Win=64682 Len=0"
"112","9.005523","25.59.115.113","25.114.157.253","TCP","60","58363  >  1234 [PSH, ACK] Seq=28 Ack=69 Win=64844 Len=1"
"113","9.007990","25.114.157.253","25.59.115.113","TCP","58","1234  >  58363 [PSH, ACK] Seq=69 Ack=29 Win=65218 Len=4"
"114","9.140834","25.59.115.113","25.114.157.253","TCP","60","58363  >  1234 [ACK] Seq=29 Ack=73 Win=64840 Len=0"
"115","9.406918","25.59.115.113","25.114.157.253","TCP","60","58363  >  1234 [PSH, ACK] Seq=29 Ack=73 Win=64840 Len=1"
"116","9.448104","25.114.157.253","25.59.115.113","TCP","54","1234  >  58363 [ACK] Seq=73 Ack=30 Win=65217 Len=0"
"117","9.449883","25.94.9.254","25.114.157.253","TCP","60","53788  >  1234 [PSH, ACK] Seq=91 Ack=1 Win=65472 Len=5"
"118","9.490777","25.114.157.253","25.94.9.254","TCP","54","1234  >  53788 [ACK] Seq=1 Ack=96 Win=64677 Len=0"
"119","9.707875","25.59.115.113","25.114.157.253","TCP","60","58363  >  1234 [PSH, ACK] Seq=30 Ack=73 Win=64840 Len=1"
"120","9.710128","25.114.157.253","25.59.115.113","TCP","58","1234  >  58363 [PSH, ACK] Seq=73 Ack=31 Win=65216 Len=4"
"121","9.799256","25.59.115.113","25.114.157.253","TCP","60","58363  >  1234 [ACK] Seq=31 Ack=77 Win=64836 Len=0"
"122","9.980967","25.94.9.254","25.114.157.253","TCP","60","53788  >  1234 [PSH, ACK] Seq=96 Ack=1 Win=65472 Len=5"
"123","9.998615","25.59.115.113","25.114.157.253","TCP","60","58363  >  1234 [PSH, ACK] Seq=31 Ack=77 Win=64836 Len=1"
"124","9.999715","25.114.157.253","25.59.115.113","TCP","58","1234  >  58363 [PSH, ACK] Seq=77 Ack=32 Win=65215 Len=4"
"125","10.020868","25.114.157.253","25.94.9.254","TCP","54","1234  >  53788 [ACK] Seq=1 Ack=101 Win=64672 Len=0"
"126","10.079681","25.59.115.113","25.114.157.253","TCP","60","58363  >  1234 [ACK] Seq=32 Ack=81 Win=64832 Len=0"
"127","10.295284","25.59.115.113","25.114.157.253","TCP","60","58363  >  1234 [PSH, ACK] Seq=32 Ack=81 Win=64832 Len=1"
"128","10.336903","25.114.157.253","25.59.115.113","TCP","54","1234  >  58363 [ACK] Seq=81 Ack=33 Win=65214 Len=0"
"129","10.504630","25.94.9.254","25.114.157.253","TCP","60","53788  >  1234 [PSH, ACK] Seq=101 Ack=1 Win=65472 Len=5"
"130","10.544938","25.114.157.253","25.94.9.254","TCP","54","1234  >  53788 [ACK] Seq=1 Ack=106 Win=64667 Len=0"
"131","10.736765","25.59.115.113","25.114.157.253","TCP","60","58363  >  1234 [PSH, ACK] Seq=33 Ack=81 Win=64832 Len=1"
"132","10.739273","25.114.157.253","25.59.115.113","TCP","58","1234  >  58363 [PSH, ACK] Seq=81 Ack=34 Win=65213 Len=4"
"133","10.827866","25.59.115.113","25.114.157.253","TCP","60","58363  >  1234 [ACK] Seq=34 Ack=85 Win=64828 Len=0"
"134","11.026140","25.94.9.254","25.114.157.253","TCP","60","53788  >  1234 [PSH, ACK] Seq=106 Ack=1 Win=65472 Len=5"
"135","11.061373","25.59.115.113","25.114.157.253","TCP","60","58363  >  1234 [PSH, ACK] Seq=34 Ack=85 Win=64828 Len=1"
"136","11.065463","25.114.157.253","25.59.115.113","TCP","58","1234  >  58363 [PSH, ACK] Seq=85 Ack=35 Win=65212 Len=4"
"137","11.066872","25.114.157.253","25.94.9.254","TCP","54","1234  >  53788 [ACK] Seq=1 Ack=111 Win=64662 Len=0"
"138","11.171311","25.59.115.113","25.114.157.253","TCP","60","58363  >  1234 [ACK] Seq=35 Ack=89 Win=64824 Len=0"
"139","11.340677","25.59.115.113","25.114.157.253","TCP","60","58363  >  1234 [PSH, ACK] Seq=35 Ack=89 Win=64824 Len=1"
"140","11.384384","25.114.157.253","25.59.115.113","TCP","54","1234  >  58363 [ACK] Seq=89 Ack=36 Win=65211 Len=0"
"141","11.543036","25.94.9.254","25.114.157.253","TCP","60","53788  >  1234 [PSH, ACK] Seq=111 Ack=1 Win=65472 Len=5"
"142","11.583065","25.114.157.253","25.94.9.254","TCP","54","1234  >  53788 [ACK] Seq=1 Ack=116 Win=64657 Len=0"
"143","11.725477","25.59.115.113","25.114.157.253","TCP","60","58363  >  1234 [PSH, ACK] Seq=36 Ack=89 Win=64824 Len=1"
"144","11.727473","25.114.157.253","25.59.115.113","TCP","58","1234  >  58363 [PSH, ACK] Seq=89 Ack=37 Win=65210 Len=4"
"145","11.821853","25.59.115.113","25.114.157.253","TCP","60","58363  >  1234 [ACK] Seq=37 Ack=93 Win=64820 Len=0"
"146","12.011497","25.59.115.113","25.114.157.253","TCP","60","58363  >  1234 [PSH, ACK] Seq=37 Ack=93 Win=64820 Len=1"
"147","12.052949","25.114.157.253","25.59.115.113","TCP","54","1234  >  58363 [ACK] Seq=93 Ack=38 Win=65209 Len=0"
"148","12.069758","25.94.9.254","25.114.157.253","TCP","60","53788  >  1234 [PSH, ACK] Seq=116 Ack=1 Win=65472 Len=5"
"149","12.110996","25.114.157.253","25.94.9.254","TCP","54","1234  >  53788 [ACK] Seq=1 Ack=121 Win=64652 Len=0"
"150","12.387407","25.59.115.113","25.114.157.253","TCP","60","58363  >  1234 [PSH, ACK] Seq=38 Ack=93 Win=64820 Len=1"
"151","12.392509","25.114.157.253","25.59.115.113","TCP","58","1234  >  58363 [PSH, ACK] Seq=93 Ack=39 Win=65208 Len=4"
"152","12.477827","25.59.115.113","25.114.157.253","TCP","60","58363  >  1234 [ACK] Seq=39 Ack=97 Win=64816 Len=0"
"153","12.599993","25.94.9.254","25.114.157.253","TCP","60","53788  >  1234 [PSH, ACK] Seq=121 Ack=1 Win=65472 Len=5"
"154","12.641058","25.114.157.253","25.94.9.254","TCP","54","1234  >  53788 [ACK] Seq=1 Ack=126 Win=64647 Len=0"
"155","12.679479","25.59.115.113","25.114.157.253","TCP","60","58363  >  1234 [PSH, ACK] Seq=39 Ack=97 Win=64816 Len=1"
"156","12.684208","25.114.157.253","25.59.115.113","TCP","58","1234  >  58363 [PSH, ACK] Seq=97 Ack=40 Win=65207 Len=4"
"157","12.774581","25.59.115.113","25.114.157.253","TCP","60","58363  >  1234 [ACK] Seq=40 Ack=101 Win=64812 Len=0"
"158","12.960204","25.59.115.113","25.114.157.253","TCP","60","58363  >  1234 [PSH, ACK] Seq=40 Ack=101 Win=64812 Len=1"
"159","13.003067","25.114.157.253","25.59.115.113","TCP","54","1234  >  58363 [ACK] Seq=101 Ack=41 Win=65206 Len=0"
"160","13.129321","25.94.9.254","25.114.157.253","TCP","60","53788  >  1234 [PSH, ACK] Seq=126 Ack=1 Win=65472 Len=5"
"161","13.172416","25.114.157.253","25.94.9.254","TCP","54","1234  >  53788 [ACK] Seq=1 Ack=131 Win=64642 Len=0"
"162","13.335454","25.59.115.113","25.114.157.253","TCP","60","58363  >  1234 [PSH, ACK] Seq=41 Ack=101 Win=64812 Len=1"
"163","13.337866","25.114.157.253","25.59.115.113","TCP","58","1234  >  58363 [PSH, ACK] Seq=101 Ack=42 Win=65205 Len=4"
"164","13.426286","25.59.115.113","25.114.157.253","TCP","60","58363  >  1234 [ACK] Seq=42 Ack=105 Win=64808 Len=0"
"165","13.648501","25.59.115.113","25.114.157.253","TCP","60","58363  >  1234 [PSH, ACK] Seq=42 Ack=105 Win=64808 Len=1"
"166","13.650821","25.94.9.254","25.114.157.253","TCP","60","53788  >  1234 [PSH, ACK] Seq=131 Ack=1 Win=65472 Len=5"
"167","13.690711","25.114.157.253","25.59.115.113","TCP","54","1234  >  58363 [ACK] Seq=105 Ack=43 Win=65204 Len=0"
"168","13.692234","25.114.157.253","25.94.9.254","TCP","54","1234  >  53788 [ACK] Seq=1 Ack=136 Win=64637 Len=0"
"169","13.918230","7a:79:19:72:9d:fd","7a:79:19:5e:09:fe","ARP","42","Who has 25.94.9.254? Tell 25.114.157.253"
"170","13.918414","7a:79:19:5e:09:fe","7a:79:19:72:9d:fd","ARP","60","25.94.9.254 is at 7a:79:19:5e:09:fe"
"171","14.020474","25.59.115.113","25.114.157.253","TCP","60","58363  >  1234 [PSH, ACK] Seq=43 Ack=105 Win=64808 Len=1"
"172","14.024141","25.114.157.253","25.59.115.113","TCP","58","1234  >  58363 [PSH, ACK] Seq=105 Ack=44 Win=65203 Len=4"
"173","14.115067","25.59.115.113","25.114.157.253","TCP","60","58363  >  1234 [ACK] Seq=44 Ack=109 Win=64804 Len=0"
"174","14.175496","25.94.9.254","25.114.157.253","TCP","60","53788  >  1234 [PSH, ACK] Seq=136 Ack=1 Win=65472 Len=5"
"175","14.216881","25.114.157.253","25.94.9.254","TCP","54","1234  >  53788 [ACK] Seq=1 Ack=141 Win=64632 Len=0"
"176","14.337625","25.59.115.113","25.114.157.253","TCP","60","58363  >  1234 [PSH, ACK] Seq=44 Ack=109 Win=64804 Len=1"
"177","14.341709","25.114.157.253","25.59.115.113","TCP","58","1234  >  58363 [PSH, ACK] Seq=109 Ack=45 Win=65202 Len=4"
"178","14.419111","7a:79:19:72:9d:fd","7a:79:19:3b:73:71","ARP","42","Who has 25.59.115.113? Tell 25.114.157.253"
"179","14.419557","7a:79:19:3b:73:71","7a:79:19:72:9d:fd","ARP","60","25.59.115.113 is at 7a:79:19:3b:73:71"
"180","14.419557","25.59.115.113","25.114.157.253","TCP","60","58363  >  1234 [ACK] Seq=45 Ack=113 Win=64800 Len=0"
"181","14.636546","25.59.115.113","25.114.157.253","TCP","60","58363  >  1234 [PSH, ACK] Seq=45 Ack=113 Win=64800 Len=1"
"182","14.677162","25.114.157.253","25.59.115.113","TCP","54","1234  >  58363 [ACK] Seq=113 Ack=46 Win=65201 Len=0"
"183","14.703069","25.94.9.254","25.114.157.253","TCP","60","53788  >  1234 [PSH, ACK] Seq=141 Ack=1 Win=65472 Len=5"
"184","14.743295","25.114.157.253","25.94.9.254","TCP","54","1234  >  53788 [ACK] Seq=1 Ack=146 Win=64627 Len=0"
"185","15.022891","25.59.115.113","25.114.157.253","TCP","60","58363  >  1234 [PSH, ACK] Seq=46 Ack=113 Win=64800 Len=1"
"186","15.025131","25.114.157.253","25.59.115.113","TCP","58","1234  >  58363 [PSH, ACK] Seq=113 Ack=47 Win=65200 Len=4"
"187","15.116670","25.59.115.113","25.114.157.253","TCP","60","58363  >  1234 [ACK] Seq=47 Ack=117 Win=64796 Len=0"
"188","15.223558","25.94.9.254","25.114.157.253","TCP","60","53788  >  1234 [PSH, ACK] Seq=146 Ack=1 Win=65472 Len=5"
"189","15.263602","25.114.157.253","25.94.9.254","TCP","54","1234  >  53788 [ACK] Seq=1 Ack=151 Win=64622 Len=0"
"190","15.396660","25.59.115.113","25.114.157.253","TCP","60","58363  >  1234 [PSH, ACK] Seq=47 Ack=117 Win=64796 Len=1"
"191","15.399002","25.114.157.253","25.59.115.113","TCP","58","1234  >  58363 [PSH, ACK] Seq=117 Ack=48 Win=65199 Len=4"
"192","15.489537","25.59.115.113","25.114.157.253","TCP","60","58363  >  1234 [ACK] Seq=48 Ack=121 Win=64792 Len=0"
"193","15.710414","25.59.115.113","25.114.157.253","TCP","60","58363  >  1234 [PSH, ACK] Seq=48 Ack=121 Win=64792 Len=1"
"194","15.741310","25.94.9.254","25.114.157.253","TCP","60","53788  >  1234 [PSH, ACK] Seq=151 Ack=1 Win=65472 Len=5"
"195","15.752006","25.114.157.253","25.59.115.113","TCP","54","1234  >  58363 [ACK] Seq=121 Ack=49 Win=65198 Len=0"
"196","15.783059","25.114.157.253","25.94.9.254","TCP","54","1234  >  53788 [ACK] Seq=1 Ack=156 Win=64617 Len=0"
"197","15.956669","25.59.115.113","25.114.157.253","TCP","60","58363  >  1234 [PSH, ACK] Seq=49 Ack=121 Win=64792 Len=1"
"198","15.958384","25.114.157.253","25.59.115.113","TCP","58","1234  >  58363 [PSH, ACK] Seq=121 Ack=50 Win=65197 Len=4"
"199","16.041622","25.59.115.113","25.114.157.253","TCP","60","58363  >  1234 [ACK] Seq=50 Ack=125 Win=64788 Len=0"
"200","16.244732","25.59.115.113","25.114.157.253","TCP","60","58363  >  1234 [PSH, ACK] Seq=50 Ack=125 Win=64788 Len=1"
"201","16.270684","25.94.9.254","25.114.157.253","TCP","60","53788  >  1234 [PSH, ACK] Seq=156 Ack=1 Win=65472 Len=5"
"202","16.286060","25.114.157.253","25.59.115.113","TCP","54","1234  >  58363 [ACK] Seq=125 Ack=51 Win=65196 Len=0"
"203","16.311903","25.114.157.253","25.94.9.254","TCP","54","1234  >  53788 [ACK] Seq=1 Ack=161 Win=64612 Len=0"
"204","16.637685","25.59.115.113","25.114.157.253","TCP","60","58363  >  1234 [PSH, ACK] Seq=51 Ack=125 Win=64788 Len=1"
"205","16.642927","25.114.157.253","25.59.115.113","TCP","58","1234  >  58363 [PSH, ACK] Seq=125 Ack=52 Win=65195 Len=4"
"206","16.806141","25.59.115.113","25.114.157.253","TCP","60","58363  >  1234 [ACK] Seq=52 Ack=129 Win=64784 Len=0"
"207","16.806213","25.94.9.254","25.114.157.253","TCP","60","53788  >  1234 [PSH, ACK] Seq=161 Ack=1 Win=65472 Len=5"
"208","16.846007","25.114.157.253","25.94.9.254","TCP","54","1234  >  53788 [ACK] Seq=1 Ack=166 Win=64607 Len=0"
"209","16.936848","25.59.115.113","25.114.157.253","TCP","60","58363  >  1234 [PSH, ACK] Seq=52 Ack=129 Win=64784 Len=1"
"210","16.941130","25.114.157.253","25.59.115.113","TCP","58","1234  >  58363 [PSH, ACK] Seq=129 Ack=53 Win=65194 Len=4"
"211","17.022986","25.59.115.113","25.114.157.253","TCP","60","58363  >  1234 [ACK] Seq=53 Ack=133 Win=64780 Len=0"
"212","17.270057","25.59.115.113","25.114.157.253","TCP","60","58363  >  1234 [PSH, ACK] Seq=53 Ack=133 Win=64780 Len=1"
"213","17.312085","25.114.157.253","25.59.115.113","TCP","54","1234  >  58363 [ACK] Seq=133 Ack=54 Win=65193 Len=0"
"214","17.314598","25.94.9.254","25.114.157.253","TCP","60","53788  >  1234 [PSH, ACK] Seq=166 Ack=1 Win=65472 Len=5"
"215","17.361717","25.114.157.253","25.94.9.254","TCP","54","1234  >  53788 [ACK] Seq=1 Ack=171 Win=64602 Len=0"
"216","17.573282","25.59.115.113","25.114.157.253","TCP","60","58363  >  1234 [PSH, ACK] Seq=54 Ack=133 Win=64780 Len=1"
"217","17.575447","25.114.157.253","25.59.115.113","TCP","58","1234  >  58363 [PSH, ACK] Seq=133 Ack=55 Win=65192 Len=4"
"218","17.659618","25.59.115.113","25.114.157.253","TCP","60","58363  >  1234 [ACK] Seq=55 Ack=137 Win=64776 Len=0"
"219","17.844072","25.59.115.113","25.114.157.253","TCP","60","58363  >  1234 [PSH, ACK] Seq=55 Ack=137 Win=64776 Len=1"
"220","17.845228","25.94.9.254","25.114.157.253","TCP","60","53788  >  1234 [PSH, ACK] Seq=171 Ack=1 Win=65472 Len=5"
"221","17.884104","25.114.157.253","25.59.115.113","TCP","54","1234  >  58363 [ACK] Seq=137 Ack=56 Win=65191 Len=0"
"222","17.887076","25.114.157.253","25.94.9.254","TCP","54","1234  >  53788 [ACK] Seq=1 Ack=176 Win=64597 Len=0"
"223","18.201425","25.59.115.113","25.114.157.253","TCP","60","58363  >  1234 [PSH, ACK] Seq=56 Ack=137 Win=64776 Len=1"
"224","18.203708","25.114.157.253","25.59.115.113","TCP","58","1234  >  58363 [PSH, ACK] Seq=137 Ack=57 Win=65190 Len=4"
"225","18.346577","25.59.115.113","25.114.157.253","TCP","60","58363  >  1234 [ACK] Seq=57 Ack=141 Win=64772 Len=0"
"226","18.612471","25.59.115.113","25.114.157.253","TCP","60","58363  >  1234 [PSH, ACK] Seq=57 Ack=141 Win=64772 Len=1"
"227","18.653970","25.114.157.253","25.59.115.113","TCP","54","1234  >  58363 [ACK] Seq=141 Ack=58 Win=65189 Len=0"
"228","18.880264","25.94.9.254","25.114.157.253","TCP","60","53788  >  1234 [PSH, ACK] Seq=176 Ack=1 Win=65472 Len=5"
"229","18.916533","25.59.115.113","25.114.157.253","TCP","60","58363  >  1234 [PSH, ACK] Seq=58 Ack=141 Win=64772 Len=1"
"230","18.918986","25.114.157.253","25.59.115.113","TCP","58","1234  >  58363 [PSH, ACK] Seq=141 Ack=59 Win=65188 Len=4"
"231","18.921231","25.114.157.253","25.94.9.254","TCP","54","1234  >  53788 [ACK] Seq=1 Ack=181 Win=64592 Len=0"
"232","19.006878","25.59.115.113","25.114.157.253","TCP","60","58363  >  1234 [ACK] Seq=59 Ack=145 Win=64768 Len=0"
"233","19.197510","25.59.115.113","25.114.157.253","TCP","60","58363  >  1234 [PSH, ACK] Seq=59 Ack=145 Win=64768 Len=1"
"234","19.237672","25.114.157.253","25.59.115.113","TCP","54","1234  >  58363 [ACK] Seq=145 Ack=60 Win=65187 Len=0"
"235","19.416174","25.94.9.254","25.114.157.253","TCP","60","53788  >  1234 [PSH, ACK] Seq=181 Ack=1 Win=65472 Len=5"
"236","19.457753","25.114.157.253","25.94.9.254","TCP","54","1234  >  53788 [ACK] Seq=1 Ack=186 Win=64587 Len=0"
"237","19.685157","25.59.115.113","25.114.157.253","TCP","60","58363  >  1234 [PSH, ACK] Seq=60 Ack=145 Win=64768 Len=1"
"238","19.687375","25.114.157.253","25.59.115.113","TCP","58","1234  >  58363 [PSH, ACK] Seq=145 Ack=61 Win=65186 Len=4"
"239","19.776607","25.59.115.113","25.114.157.253","TCP","60","58363  >  1234 [ACK] Seq=61 Ack=149 Win=64764 Len=0"
"240","19.955386","25.94.9.254","25.114.157.253","TCP","60","53788  >  1234 [PSH, ACK] Seq=186 Ack=1 Win=65472 Len=5"
"241","19.955484","25.59.115.113","25.114.157.253","TCP","60","58363  >  1234 [PSH, ACK] Seq=61 Ack=149 Win=64764 Len=1"
"242","19.959371","25.114.157.253","25.59.115.113","TCP","58","1234  >  58363 [PSH, ACK] Seq=149 Ack=62 Win=65185 Len=4"
"243","19.996521","25.114.157.253","25.94.9.254","TCP","54","1234  >  53788 [ACK] Seq=1 Ack=191 Win=64582 Len=0"
"244","20.041244","25.59.115.113","25.114.157.253","TCP","60","58363  >  1234 [ACK] Seq=62 Ack=153 Win=64760 Len=0"
"245","20.221906","25.59.115.113","25.114.157.253","TCP","60","58363  >  1234 [PSH, ACK] Seq=62 Ack=153 Win=64760 Len=1"
"246","20.262252","25.114.157.253","25.59.115.113","TCP","54","1234  >  58363 [ACK] Seq=153 Ack=63 Win=65184 Len=0"
"247","20.489574","25.59.115.113","25.114.157.253","TCP","60","58363  >  1234 [PSH, ACK] Seq=63 Ack=153 Win=64760 Len=1"
"248","20.489657","25.94.9.254","25.114.157.253","TCP","60","53788  >  1234 [PSH, ACK] Seq=191 Ack=1 Win=65472 Len=5"
"249","20.493095","25.114.157.253","25.59.115.113","TCP","58","1234  >  58363 [PSH, ACK] Seq=153 Ack=64 Win=65183 Len=4"
"250","20.530706","25.114.157.253","25.94.9.254","TCP","54","1234  >  53788 [ACK] Seq=1 Ack=196 Win=64577 Len=0"
"251","20.578427","25.59.115.113","25.114.157.253","TCP","60","58363  >  1234 [ACK] Seq=64 Ack=157 Win=64756 Len=0"
"252","20.776841","25.59.115.113","25.114.157.253","TCP","60","58363  >  1234 [PSH, ACK] Seq=64 Ack=157 Win=64756 Len=1"
"253","20.817989","25.114.157.253","25.59.115.113","TCP","54","1234  >  58363 [ACK] Seq=157 Ack=65 Win=65182 Len=0"
"254","21.025824","25.94.9.254","25.114.157.253","TCP","60","53788  >  1234 [PSH, ACK] Seq=196 Ack=1 Win=65472 Len=5"
"255","21.025916","25.59.115.113","25.114.157.253","TCP","60","58363  >  1234 [PSH, ACK] Seq=65 Ack=157 Win=64756 Len=1"
"256","21.065392","25.114.157.253","25.59.115.113","TCP","54","1234  >  58363 [ACK] Seq=157 Ack=66 Win=65181 Len=0"
"257","21.066916","25.114.157.253","25.94.9.254","TCP","54","1234  >  53788 [ACK] Seq=1 Ack=201 Win=64572 Len=0"
"258","21.402794","25.59.115.113","25.114.157.253","TCP","60","58363  >  1234 [PSH, ACK] Seq=66 Ack=157 Win=64756 Len=1"
"259","21.405141","25.114.157.253","25.59.115.113","TCP","58","1234  >  58363 [PSH, ACK] Seq=157 Ack=67 Win=65180 Len=4"
"260","21.484391","25.94.9.254","25.114.157.253","TCP","60","53788  >  1234 [PSH, ACK] Seq=201 Ack=1 Win=65472 Len=5"
"261","21.493953","25.59.115.113","25.114.157.253","TCP","60","58363  >  1234 [ACK] Seq=67 Ack=161 Win=64752 Len=0"
"262","21.527313","25.114.157.253","25.94.9.254","TCP","54","1234  >  53788 [ACK] Seq=1 Ack=206 Win=64567 Len=0"
"263","21.696030","25.59.115.113","25.114.157.253","TCP","60","58363  >  1234 [PSH, ACK] Seq=67 Ack=161 Win=64752 Len=1"
"264","21.698044","25.114.157.253","25.59.115.113","TCP","58","1234  >  58363 [PSH, ACK] Seq=161 Ack=68 Win=65179 Len=4"
"265","21.779354","25.59.115.113","25.114.157.253","TCP","60","58363  >  1234 [ACK] Seq=68 Ack=165 Win=64748 Len=0"
"266","22.004740","25.59.115.113","25.114.157.253","TCP","60","58363  >  1234 [PSH, ACK] Seq=68 Ack=165 Win=64748 Len=1"
"267","22.011012","25.94.9.254","25.114.157.253","TCP","60","53788  >  1234 [PSH, ACK] Seq=206 Ack=1 Win=65472 Len=5"
"268","22.045383","25.114.157.253","25.59.115.113","TCP","54","1234  >  58363 [ACK] Seq=165 Ack=69 Win=65178 Len=0"
"269","22.053309","25.114.157.253","25.94.9.254","TCP","54","1234  >  53788 [ACK] Seq=1 Ack=211 Win=64562 Len=0"
"270","22.393502","25.59.115.113","25.114.157.253","TCP","60","58363  >  1234 [PSH, ACK] Seq=69 Ack=165 Win=64748 Len=1"
"271","22.395628","25.114.157.253","25.59.115.113","TCP","58","1234  >  58363 [PSH, ACK] Seq=165 Ack=70 Win=65177 Len=4"
"272","22.483796","25.59.115.113","25.114.157.253","TCP","60","58363  >  1234 [ACK] Seq=70 Ack=169 Win=64744 Len=0"
"273","22.528694","25.94.9.254","25.114.157.253","TCP","60","53788  >  1234 [PSH, ACK] Seq=211 Ack=1 Win=65472 Len=5"
"274","22.570606","25.114.157.253","25.94.9.254","TCP","54","1234  >  53788 [ACK] Seq=1 Ack=216 Win=64557 Len=0"
"275","22.674658","25.59.115.113","25.114.157.253","TCP","60","58363  >  1234 [PSH, ACK] Seq=70 Ack=169 Win=64744 Len=1"
"276","22.676772","25.114.157.253","25.59.115.113","TCP","58","1234  >  58363 [PSH, ACK] Seq=169 Ack=71 Win=65176 Len=4"
"277","22.770321","25.59.115.113","25.114.157.253","TCP","60","58363  >  1234 [ACK] Seq=71 Ack=173 Win=64740 Len=0"
"278","22.968739","25.59.115.113","25.114.157.253","TCP","60","58363  >  1234 [PSH, ACK] Seq=71 Ack=173 Win=64740 Len=1"
"279","23.010144","25.114.157.253","25.59.115.113","TCP","54","1234  >  58363 [ACK] Seq=173 Ack=72 Win=65175 Len=0"
"280","23.046547","25.94.9.254","25.114.157.253","TCP","60","53788  >  1234 [PSH, ACK] Seq=216 Ack=1 Win=65472 Len=5"
"281","23.090501","25.114.157.253","25.94.9.254","TCP","54","1234  >  53788 [ACK] Seq=1 Ack=221 Win=64552 Len=0"
"282","23.349635","25.59.115.113","25.114.157.253","TCP","60","58363  >  1234 [PSH, ACK] Seq=72 Ack=173 Win=64740 Len=1"
"283","23.351820","25.114.157.253","25.59.115.113","TCP","58","1234  >  58363 [PSH, ACK] Seq=173 Ack=73 Win=65174 Len=4"
"284","23.444092","25.59.115.113","25.114.157.253","TCP","60","58363  >  1234 [ACK] Seq=73 Ack=177 Win=64736 Len=0"
"285","23.563525","25.94.9.254","25.114.157.253","TCP","60","53788  >  1234 [PSH, ACK] Seq=221 Ack=1 Win=65472 Len=5"
"286","23.604186","25.114.157.253","25.94.9.254","TCP","54","1234  >  53788 [ACK] Seq=1 Ack=226 Win=64547 Len=0"
"287","23.661964","25.59.115.113","25.114.157.253","TCP","60","58363  >  1234 [PSH, ACK] Seq=73 Ack=177 Win=64736 Len=1"
"288","23.664092","25.114.157.253","25.59.115.113","TCP","58","1234  >  58363 [PSH, ACK] Seq=177 Ack=74 Win=65173 Len=4"
"289","23.753079","25.59.115.113","25.114.157.253","TCP","60","58363  >  1234 [ACK] Seq=74 Ack=181 Win=64732 Len=0"
"290","23.950104","25.59.115.113","25.114.157.253","TCP","60","58363  >  1234 [PSH, ACK] Seq=74 Ack=181 Win=64732 Len=1"
"291","23.991362","25.114.157.253","25.59.115.113","TCP","54","1234  >  58363 [ACK] Seq=181 Ack=75 Win=65172 Len=0"
"292","24.080711","25.94.9.254","25.114.157.253","TCP","60","53788  >  1234 [PSH, ACK] Seq=226 Ack=1 Win=65472 Len=5"
"293","24.120821","25.114.157.253","25.94.9.254","TCP","54","1234  >  53788 [ACK] Seq=1 Ack=231 Win=64542 Len=0"
"294","24.324403","25.59.115.113","25.114.157.253","TCP","60","58363  >  1234 [PSH, ACK] Seq=75 Ack=181 Win=64732 Len=1"
"295","24.326959","25.114.157.253","25.59.115.113","TCP","58","1234  >  58363 [PSH, ACK] Seq=181 Ack=76 Win=65171 Len=4"
"296","24.417575","25.59.115.113","25.114.157.253","TCP","60","58363  >  1234 [ACK] Seq=76 Ack=185 Win=64728 Len=0"
"297","24.608568","25.94.9.254","25.114.157.253","TCP","60","53788  >  1234 [PSH, ACK] Seq=231 Ack=1 Win=65472 Len=5"
"298","24.637643","25.59.115.113","25.114.157.253","TCP","60","58363  >  1234 [PSH, ACK] Seq=76 Ack=185 Win=64728 Len=1"
"299","24.651433","25.114.157.253","25.94.9.254","TCP","54","1234  >  53788 [ACK] Seq=1 Ack=236 Win=64537 Len=0"
"300","24.658984","25.114.157.253","25.59.115.113","TCP","58","1234  >  58363 [PSH, ACK] Seq=185 Ack=77 Win=65170 Len=4"
"301","24.744488","25.59.115.113","25.114.157.253","TCP","60","58363  >  1234 [ACK] Seq=77 Ack=189 Win=64724 Len=0"
"302","24.947527","25.59.115.113","25.114.157.253","TCP","60","58363  >  1234 [PSH, ACK] Seq=77 Ack=189 Win=64724 Len=1"
"303","24.987732","25.114.157.253","25.59.115.113","TCP","54","1234  >  58363 [ACK] Seq=189 Ack=78 Win=65169 Len=0"
"304","25.134095","25.94.9.254","25.114.157.253","TCP","60","53788  >  1234 [PSH, ACK] Seq=236 Ack=1 Win=65472 Len=5"
"305","25.174310","25.114.157.253","25.94.9.254","TCP","54","1234  >  53788 [ACK] Seq=1 Ack=241 Win=64532 Len=0"
"306","25.402038","25.59.115.113","25.114.157.253","TCP","60","58363  >  1234 [PSH, ACK] Seq=78 Ack=189 Win=64724 Len=1"
"307","25.404285","25.114.157.253","25.59.115.113","TCP","58","1234  >  58363 [PSH, ACK] Seq=189 Ack=79 Win=65168 Len=4"
"308","25.503956","25.59.115.113","25.114.157.253","TCP","60","58363  >  1234 [ACK] Seq=79 Ack=193 Win=64720 Len=0"
"309","25.683061","25.59.115.113","25.114.157.253","TCP","60","58363  >  1234 [PSH, ACK] Seq=79 Ack=193 Win=64720 Len=1"
"310","25.683151","25.94.9.254","25.114.157.253","TCP","60","53788  >  1234 [PSH, ACK] Seq=241 Ack=1 Win=65472 Len=5"
"311","25.723195","25.114.157.253","25.94.9.254","TCP","54","1234  >  53788 [ACK] Seq=1 Ack=246 Win=64527 Len=0"
"312","25.723218","25.114.157.253","25.59.115.113","TCP","54","1234  >  58363 [ACK] Seq=193 Ack=80 Win=65167 Len=0"
"313","25.964094","25.59.115.113","25.114.157.253","TCP","60","58363  >  1234 [PSH, ACK] Seq=80 Ack=193 Win=64720 Len=1"
"314","25.966275","25.114.157.253","25.59.115.113","TCP","58","1234  >  58363 [PSH, ACK] Seq=193 Ack=81 Win=65166 Len=4"
"315","26.068522","25.59.115.113","25.114.157.253","TCP","60","58363  >  1234 [ACK] Seq=81 Ack=197 Win=64716 Len=0"
"316","26.243376","25.94.9.254","25.114.157.253","TCP","60","53788  >  1234 [PSH, ACK] Seq=246 Ack=1 Win=65472 Len=5"
"317","26.284333","25.114.157.253","25.94.9.254","TCP","54","1234  >  53788 [ACK] Seq=1 Ack=251 Win=64522 Len=0"
"318","26.523923","25.59.115.113","25.114.157.253","TCP","60","58363  >  1234 [PSH, ACK] Seq=81 Ack=197 Win=64716 Len=1"
"319","26.526205","25.114.157.253","25.59.115.113","TCP","58","1234  >  58363 [PSH, ACK] Seq=197 Ack=82 Win=65165 Len=4"
"320","26.580850","25.59.115.113","25.114.157.253","TCP","60","58363  >  1234 [PSH, ACK] Seq=82 Ack=201 Win=64712 Len=1"
"321","26.621378","25.114.157.253","25.59.115.113","TCP","54","1234  >  58363 [ACK] Seq=201 Ack=83 Win=65164 Len=0"
"322","26.808088","25.94.9.254","25.114.157.253","TCP","60","53788  >  1234 [PSH, ACK] Seq=251 Ack=1 Win=65472 Len=5"
"323","26.821468","25.59.115.113","25.114.157.253","TCP","60","58363  >  1234 [PSH, ACK] Seq=83 Ack=201 Win=64712 Len=1"
"324","26.824194","25.114.157.253","25.59.115.113","TCP","58","1234  >  58363 [PSH, ACK] Seq=201 Ack=84 Win=65163 Len=4"
"325","26.848070","25.114.157.253","25.94.9.254","TCP","54","1234  >  53788 [ACK] Seq=1 Ack=256 Win=64517 Len=0"
"326","26.927970","25.59.115.113","25.114.157.253","TCP","60","58363  >  1234 [ACK] Seq=84 Ack=205 Win=64708 Len=0"
"327","27.127685","25.59.115.113","25.114.157.253","TCP","60","58363  >  1234 [PSH, ACK] Seq=84 Ack=205 Win=64708 Len=1"
"328","27.167653","25.114.157.253","25.59.115.113","TCP","54","1234  >  58363 [ACK] Seq=205 Ack=85 Win=65162 Len=0"
"329","27.268047","25.94.9.254","25.114.157.253","TCP","60","53788  >  1234 [PSH, ACK] Seq=256 Ack=1 Win=65472 Len=5"
"330","27.308047","25.114.157.253","25.94.9.254","TCP","54","1234  >  53788 [ACK] Seq=1 Ack=261 Win=64512 Len=0"
"331","27.537860","25.59.115.113","25.114.157.253","TCP","60","58363  >  1234 [PSH, ACK] Seq=85 Ack=205 Win=64708 Len=1"
"332","27.541205","25.114.157.253","25.59.115.113","TCP","58","1234  >  58363 [PSH, ACK] Seq=205 Ack=86 Win=65161 Len=4"
"333","27.624415","25.59.115.113","25.114.157.253","TCP","60","58363  >  1234 [ACK] Seq=86 Ack=209 Win=64704 Len=0"
"334","27.801465","25.94.9.254","25.114.157.253","TCP","60","53788  >  1234 [PSH, ACK] Seq=261 Ack=1 Win=65472 Len=5"
"335","27.842335","25.114.157.253","25.94.9.254","TCP","54","1234  >  53788 [ACK] Seq=1 Ack=266 Win=64507 Len=0"
"336","27.852467","25.59.115.113","25.114.157.253","TCP","60","58363  >  1234 [PSH, ACK] Seq=86 Ack=209 Win=64704 Len=1"
"337","27.854640","25.114.157.253","25.59.115.113","TCP","58","1234  >  58363 [PSH, ACK] Seq=209 Ack=87 Win=65160 Len=4"
"338","27.946532","25.59.115.113","25.114.157.253","TCP","60","58363  >  1234 [ACK] Seq=87 Ack=213 Win=64700 Len=0"
"339","28.147680","25.59.115.113","25.114.157.253","TCP","60","58363  >  1234 [PSH, ACK] Seq=87 Ack=213 Win=64700 Len=1"
